Property Name,City,State,Property Description,Leisure Activities,Brand,Total Guest Rooms,Total Meeting Rooms,Total Meeting Space,Largest Ballroom (Sq Ft),Closest Airport,Website URL,Hero Image URL,Travel Time to the Nearest Airport,Max Capacity of Largest Meeting Space,Peak Season,Slow Season,The Hero Feature,Friction Point,Pricing Tier,Breakout Capabilities (Total Mtg Sq Ft/Total Mtg Rooms),Vibe Tags,AI Reasoning
Arizona Biltmore,Phoenix,Arizona,"An iconic 39-acre luxury resort known as the ""Jewel of the Desert,"" featuring Frank Lloyd Wright-inspired architecture, newly transformed accommodations, and historic prestige.","Seven swimming pools including a 65-foot waterslide, Tierra Luna full-service spa, state-of-the-art fitness center, two championship golf courses, and seven dining outlets.",LXR Hotels & Resorts,705,77,"200,000","24,756",Phoenix Sky Harbor International Airport (PHX),https://www.arizonabiltmore.com/,,15 minutes from PHX,"2,500",Jan-April,June-Aug,Historic Frank Lloyd Wright-inspired architecture within a lush luxury desert oasis,Massive property with a confusing layout requiring long walks to meeting spaces,5,2597,Historic Charm | Luxury/Pampering | Public/See-and-be-Seen,"Known as the ""Jewel of the Desert,"" this 1929 architectural landmark offers deep storytelling through its Frank Lloyd Wright-inspired design (Historic), provides highly exclusive amenities like the Tierra Luna Spa and Citrus Club (Luxury), and maintains a vibrant social scene centered around its lively Spire Bar and renowned pools that consistently attract a high-profile crowd (Public)."
Bellwether Beach Resort,St. Pete Beach,Florida,"A retro-Florida meets modern-chic beachfront resort housed in an iconic 12-story tower directly on the white sands of St. Pete Beach, featuring panoramic views of the Gulf of Mexico.","Direct beach access with cabanas, outdoor heated pool, watersports, Level 11 Rooftop Bar & Lounge, Spinners Rooftop Grille, early riser yoga, and live music.",Benchmark Resorts & Hotels,156,3,"8,000","3,110",St. Pete-Clearwater International Airport (PIE),https://www.bellwetherbeachresort.com/,,35 minutes from TPA,400,Jan-Apr,Jul-Aug,Iconic spinning rooftop restaurant offering 360-degree panoramic Gulf Coast views,Tall tower layout with severely limited and frequently broken elevators causing bottlenecks,3,2667,Historic Charm | High-Energy/Buzzing | Public/See-and-be-Seen,"Embracing a nostalgic, ""retro-Florida"" design that leans into its vintage coastal history (Historic), this property acts as a highly visible social hub for locals and influencers (Public) who are drawn to the lively, music-filled atmosphere of its beachfront bars and the iconic Level 11 Rooftop Lounge (High-Energy)."
Black Rock Mountain Resort,Heber City,Utah,"A luxury mountain resort set against the Wasatch Mountains, offering elevated accommodations, scenic dining, and direct access to year-round adventure just minutes from downtown Park City and world-class ski slopes.","Heated outdoor pool, oversized hot tubs, sauna and steam room, 24-hour fitness center, game room, and access to nearby skiing, hiking, and mountain biking.",Benchmark Resorts & Hotels,148,9,"28,023","4,958",Salt Lake City International Airport (SLC),https://www.blackrockmountainresort.com/,,40 minutes from SLC,500,Dec-Mar,"Apr-May, Oct-Nov","15,000 sq. ft. event center with an indoor ice rink","Sparse parking, paper-thin walls, and inconsistent shuttle service",3,3114,Athletic/Active | Luxury/Pampering | Wellness/Zen,"Positioned as a premier gateway for world-class skiing and Wasatch mountain adventures (Athletic), this sleek property provides a high-end, modern retreat with elevated condo-style accommodations (Luxury), while offering a serene environment complete with saunas, steam rooms, and recovery-focused services like IV therapy for post-adventure relaxation (Wellness)."
Boston Marriott Burlington,Burlington,Massachusetts,"A recently renovated full-service hotel offering elevated amenities, a thoughtfully designed M Club lounge, an open-concept Great Room, and an inviting lobby with a fireplace, providing easy access to Boston and local attractions.","Indoor and outdoor pools, 24-hour fitness center, on-site dining at CHOPPS American Bar & Grill, an outdoor Terrace with fire pits, and easy access to nearby shopping.",Marriott Hotels,418,20,"14,570","9,000",Boston Logan International Airport (BOS),https://www.marriott.com/en-us/hotels/bosbu-boston-marriott-burlington/overview/,,30 minutes from BOS,"1,000","Sep-Oct, May-Jun","Jan-Feb, Jul-Aug",All meeting space conveniently located on one single level,Frequent room key card malfunctions and inconsistent climate control,2,729,Serious/Academic | Modern/Industrial | Public/See-and-be-Seen,"Functioning as a major suburban conference destination with nearly 15,000 square feet of dedicated event space (Serious), this recently renovated property features a sleek, contemporary design (Modern) and an intentionally activated lobby and chophouse that serve as a communal networking scene with live weekend entertainment (Public)."
Cambridge Beaches Resort & Spa,Sandys Parish,Bermuda,"A historic 20-acre oceanfront resort set on a private peninsula, featuring authentic cottage-style accommodations, stunning water views, and classic Bermudian charm.","Four private beaches, outdoor infinity pool, indoor pool and hot tub, 10,000 Ocean Spa, fitness center, tennis courts, croquet lawn, putting green, and watersports.",Benchmark Resorts & Hotels,86,4,"5,341","3,221",L.F. Wade International Airport (BDA),https://www.cambridgebeaches.com,,45 minutes from BDA,250,May-Oct,Nov-Mar,300-year-old historic resort offering four private beaches and lush cottage-style accommodations,Expansive 23-acre layout requires relying on staff-driven golf carts or long walks between venues,4,1335,Secluded/Private | Historic Charm | Wellness/Zen,"Situated on a highly exclusive 23-acre private peninsula with four secluded beaches and standalone accommodations (Secluded), this 1920s-era resort embraces its authentic Bermudian history and old-world architecture (Historic) while providing a hushed, tranquil environment anchored by a full-service spa and serene ocean views (Wellness)."
Chaminade Resort & Spa,Santa Cruz,California,"A historic 300-acre luxury mountaintop retreat featuring 1930s Spanish Revival architecture and sweeping views of Monterey Bay, located just minutes from the Santa Cruz Beach Boardwalk.","Full-service spa, outdoor heated pool and hot tubs, four miles of scenic hiking trails, fitness center, tennis and pickleball courts, fire pits, and on-site dining.",Benchmark Resorts & Hotels,156,12,"12,000","2,650",San Jose Mineta International Airport (SJC),https://www.chaminade.com,,45 minutes from SJC,230,"Sep-Oct, Apr-May","Dec-Feb, Jul-Aug",Mountaintop resort on 300 wooded acres with sweeping Monterey Bay views,Spread-out layout lacking elevators in certain areas with poor noise insulation,3,1000,Serious/Academic | Secluded/Private | Wellness/Zen,"Operating as a premier mountaintop conference destination with dedicated ""Benchmark Conference Plan"" meeting facilities (Serious), this 300-acre forested estate provides a highly isolated, retreat-like environment overlooking Monterey Bay (Secluded) and emphasizes natural decompression with a full-service spa, redwood hiking trails, and guided forest therapy (Wellness)."
Chatham Bars Inn,Chatham,Massachusetts,"A historic Forbes Five-Star oceanfront resort built in 1914, set on 25 seaside acres overlooking Chatham Harbor and the Atlantic Ocean, featuring classic New England charm.","Quarter-mile private beach, heated oceanfront pool with cabanas, full-service spa, tennis, classic Cape Cod activities, and farm-to-table dining from the resort's own 8-acre farm.",Benchmark Resorts & Hotels,217,15,"19,437","4,500",Boston Logan International Airport (BOS),https://www.chathambarsinn.com,,90 minutes from BOS,280,May-Oct,Nov-Apr,Historic oceanfront luxury resort with a private beach and sweeping Atlantic views,Sprawling 25-acre cottage layout requires walking outdoors in potentially harsh coastal weather,5,1296,Historic Charm | Luxury/Pampering | Public/See-and-be-Seen,"Operating since 1914 with quintessential New England architecture and deep storytelling (Historic), this Forbes Five-Star property offers top-tier amenities like private yacht charters and a complimentary Lexus drive program (Luxury), while its lively Beach House Grill and bustling summer atmosphere consistently draw a highly visible crowd of influencers and locals (Public)."
Clearwater Beach Marriott Suites on Sand Key,Clearwater Beach,Florida,"A newly renovated all-suite resort located directly on the intracoastal waterway across from Sand Key Park, offering panoramic bay views and waterfront luxury.","Outdoor pool with a 35-foot cascading waterfall, interactive splash pad, private cabanas, on-site watersport rentals, full-service spa, 24-hour fitness center, and nearby beach access.",Marriott Hotels,220,12,"11,729","3,330",St. Pete-Clearwater International Airport (PIE),https://www.marriott.com/en-us/hotels/tpams-clearwater-beach-marriott-resort-on-sand-key/overview/,,35 minutes from PIE,340,January-Feburay October-November,July-August,So with our hotel property we have a really unique boomerang shaped building so I try to get a fight room on the 10th floor just to be able to show them that amazing view of water on both sides of the property at the huge selling point for us especially because of the placement of the rooms they get the sunrise and the sunset.,You know we don't necessarily get complaints here at the property there's definitely you know moments can be for negotiations for our clients once in a while we'll get some rebuttal on the resort fee but that's pretty much all that comes to mind at this time. ,3,977,Wellness/Zen | Athletic/Active | Public/See-and-be-Seen,"This all-suite bayfront resort offers a full-service spa and peaceful views of Sand Key Park for relaxation (Wellness), features on-site watersport rentals and a 24-hour fitness center for active guests (Athletic), and centers its social energy around Clearwater's largest pool deck, complete with a cascading waterfall, private cabanas, and vibrant evening fire pits (Public)."
Cleveland Marriott East,Warrensville Heights,Ohio,"An upscale hotel located near Beachwood offering modern guest rooms, extensive event facilities, an exclusive M Club lounge, and easy access to downtown Cleveland.","Indoor pool, 24-hour fitness center, on-site dining at RC Grille, lobby Starbucks, and close proximity to premium shopping at Beachwood Place.",Marriott Hotels,295,14,"16,089","7,480",Cleveland Hopkins International Airport (CLE),https://www.marriott.com/en-us/hotels/cleem-cleveland-marriott-east/overview/,,30 minutes from CLE,920,"Sep-Oct, May-Jun","Jan-Feb, Jul-Aug","Suburban property featuring over 16,000 square feet of versatile meeting space",Noticeable highway noise for interstate-facing rooms and frequent in-room fixture maintenance issues,2,1149,Serious/Academic | Modern/Industrial,"Operating as a primary suburban event hub with over 16,000 square feet of dedicated meeting space, this property caters heavily to corporate conferences and ""heads down"" business travelers (Serious) within a recently renovated, highly functional, and contemporary environment designed for travel and meeting efficiency (Modern)."
Costa d'Este Beach Resort & Spa,Vero Beach,Florida,"A chic oceanfront resort owned by Gloria and Emilio Estefan featuring a Miami vibe, modern design, and direct private beach access on Florida's Treasure Coast.","Direct beach access, oceanfront infinity pool, full-service C|Spa, stand-up paddleboards, ocean kayaking, snorkeling, fitness center, and beach cruiser bicycles.",Benchmark Resorts & Hotels,94,3,"3,700","1,200",Melbourne Orlando International Airport (MLB),https://www.costadeste.com/,,45 minutes from MLB,120,Jan-Apr,Jul-Aug,Celebrity-owned mid-century modern luxury oceanfront resort by Gloria and Emilio Estefan,"Spread-out two-tower layout requires walking outdoors, with limited parking and frequent noise complaints",4,1233,Luxury/Pampering | Public/See-and-be-Seen | Wellness/Zen,"Owned by Gloria and Emilio Estefan, this chic boutique resort brings a sophisticated ""Miami style"" social scene to its oceanfront pool and cabana bar (Public), while offering high-end, personalized beach service (Luxury) and restorative experiences like sunrise yoga and a full-service C|Spa (Wellness)."
Dellshire Resort,Wisconsin Dells,Wisconsin,"Opening in spring 2026, this four-story medieval-themed resort brings an immersive escape to the Waterpark Capital of the World, featuring storybook-inspired designs and a 60-foot fire-breathing dragon entrance.","9,000-sq.-ft. Hero's Hall family entertainment center with a mixed-reality adventure, six indoor/outdoor pools and hot tubs including a swim-up bar.",Benchmark Resorts & Hotels,208,3,"6,800","4,000",Dane County Regional Airport (MSN),https://www.dellshireresort.com/,,55 minutes from MSN,300,"Sep-Oct, May-Jun","Dec-Feb, Jul-Aug",Immersive medieval-themed resort with a 60-foot fire-breathing dragon,Opening Spring 2026; no public reviews available yet,3,2267,High-Energy/Buzzing | Novelty/Themed | Serious/Academic,"Opening in spring 2026 in the heart of Wisconsin Dells, this medieval-themed property heavily targets families and leisure travelers with its six pools, massive entertainment center, and interactive mixed-reality quests (High-Energy), leans completely into a storybook castle aesthetic complete with a 60-foot fire-breathing dragon (Novelty/Themed), yet still provides nearly 7,000 square feet of dedicated meeting space to accommodate corporate retreats and group events (Serious/Academic)."
Delta Hotels Jacksonville Deerwood,Jacksonville,Florida,"A modern six-story hotel located in Jacksonville's Southside near St. Johns Town Center, designed for frequent travelers with an inviting lobby and updated amenities.","24-hour fitness center, outdoor pool, lobby bar, Delta Pantry, and access to nearby golf courses and beaches.",Delta Hotels by Marriott,166,5,"3,795","1,306",Jacksonville International Airport (JAX),https://www.marriott.com/en-us/hotels/jaxde-delta-hotels-jacksonville-deerwood/overview/,,30 minutes from JAX,120,January-March,June-August,"Features the signature Delta Pantry for elite members, offering 24/7 access to premium snacks and beverages in a modern setting.",Distance from the main downtown city center may require additional travel time for off-site dining or entertainment.,2,759,Serious/Academic | Modern/Industrial,"Situated in a corporate park environment, this business-centric hotel prioritizes functional efficiency with dedicated meeting spaces and ergonomic in-room workstations (Serious), wrapped in a streamlined, contemporary aesthetic designed specifically for the frequent transient traveler (Modern)."
Doubletree Boston Logan Airport Chelsea,Chelsea,Massachusetts,"A modern hotel located just three miles from downtown Boston and minutes from Logan International Airport, offering easy access to city attractions and public transportation.","Indoor heated pool, fitness center, on-site dining at Pendulum Pub, and quick access to downtown Boston entertainment and shopping.",DoubleTree by Hilton,180,3,"1,200","1,200",Boston Logan International Airport (BOS),https://www.hilton.com/en/hotels/bosacdt-doubletree-boston-logan-airport-chelsea/,,10 minutes from BOS,132,"April-June, September-October",November-March,The restuarant pub," Parking fees are usually the main concern, which they try to waive",2,400,Serious/Academic | Modern/Industrial,"Operating primarily as a functional hub for transient flyers and business travelers just minutes from Logan Airport, this property prioritizes meeting capabilities and rapid-turnaround efficiency (Serious) within a recently renovated, contemporary layout designed for straightforward convenience (Modern)."
Doubletree by Hilton Denver,Denver,Colorado,"Located between downtown and the airport, this hotel offers convenient access to the Central Park Train Station, The Shops at Northfield, and local attractions, starting every stay with a warm signature cookie.","Indoor pool, outdoor hot tub, 24-hour fitness center, and on-site dining including Knife & Board and Character's Sports Bar.",DoubleTree by Hilton,563,20,"32,000","9,660",Denver International Airport (DEN),https://www.hilton.com/en/hotels/rldv-dt-doubletree-denver/,,20 minutes from DEN,"1,200",Jun-Aug,Nov-Jan,"32,000 sq. ft. of flexible space including a 10,000 sq. ft. Grand Ballroom","High parking fees, frequent elevator delays, and inconsistent room climate control",2,1600,Serious/Academic | Modern/Industrial,"Functioning as a major convention destination with 32,000 square feet of dedicated event space and suites featuring private conference tables (Serious), this property caters heavily to transient and corporate travelers, providing a highly functional, centralized environment designed for high-efficiency business turnarounds between downtown Denver and the airport (Modern)."
Doubletree Jacksonville Airport,Jacksonville,Florida,"Located just 200 yards from the main terminal, this modern hotel offers a serene environment with a lakeside lanai and warm signature cookie welcome, providing unmatched convenience for travelers.","Outdoor saltwater pool, lakeside lanai, 24-hour fitness center, and on-site dining at Frequency Restaurant and Lounge featuring pond and waterfall views.",DoubleTree by Hilton,202,7,"10,190","4,000",Jacksonville International Airport (JAX),https://www.hilton.com/en/hotels/jaxardt-doubletree-jacksonville-airport/,,2 minutes from JAX,300,Jan-Apr,Jul-Aug,Located directly on airport grounds with a complimentary 24-hour terminal shuttle,"Outdated property showing its age with musty odors, peeling wallpaper, and unexpected parking fees",2,1456,Serious/Academic | Modern/Industrial,"Operating primarily as a highly convenient transit hub situated just 200 yards from the main terminal, this property prioritizes rapid-turnaround efficiency and corporate gatherings with 11,000 square feet of versatile meeting space (Serious), providing a functional, streamlined environment designed to meet the immediate needs of frequent flyers and business travelers (Modern)."
Doubletree Manchester Downtown,Manchester,New Hampshire,"A modern high-rise hotel located in the heart of downtown Manchester, offering scenic city views and easy walking access to Elm Street dining, shopping, and the SNHU Arena.","Indoor heated swimming pool, 24-hour fitness center, and on-site dining at The Current Kitchen & Bar and JD's Tavern.",DoubleTree by Hilton,248,16,"58,317","30,000",Manchester-Boston Regional Airport (MHT),https://www.hilton.com/en/hotels/mhtmndt-doubletree-manchester-downtown/,,10 minutes from MHT,"1,000","Sep-Oct, May-Jun","Jan-Feb, Jul-Aug","Connected to the massive 30,000-square-foot Center of New Hampshire Expo Center",Confusing attached municipal parking garage requires a long walk and frequent elevator delays,2,3645,Serious/Academic | Modern/Industrial,"Functioning as a major New England convention hub with over 58,000 square feet of event space and a massive dedicated Expo Center, this downtown property caters heavily to large-scale conferences and corporate gatherings (Serious), providing a highly functional, recently renovated environment designed for maximum event efficiency and straightforward access to the nearby SNHU Arena (Modern)."
Doubletree NY Downtown,New York,New York,"A modern high-rise hotel located in Lower Manhattan's Stone Street Historic District, offering easy access to the Financial District, Wall Street, and Battery Park.","24-hour fitness center, on-site dining at Antica Ristorante, and quick access to downtown historic attractions, shopping, and the Staten Island Ferry.",DoubleTree by Hilton,399,1,234,"1,100",LaGuardia Airport (LGA),https://www.hilton.com/en/hotels/nycbpdt-doubletree-new-york-downtown/,,40 minutes from JFK,80,"q2, September-December","July-august, January-February",N/A Rooms only,Elevators,2,234,Serious/Academic | High-Energy/Buzzing | Modern/Industrial,"Located in the heart of the Financial District, this high-rise property heavily caters to corporate travelers and Wall Street professionals with a ""heads down"" business focus (Serious), immerses guests in the intense, bustling street-level atmosphere of lower Manhattan (High-Energy), and features a highly functional, contemporary interior designed for maximum efficiency in a dense urban setting (Modern)."
Embassy Suites Boston Marlborough,Marlborough,Massachusetts,"A full-service all-suite hotel located near major corporate parks and the New England Sports Center, offering spacious two-room suites and signature Hilton hospitality.","Indoor heated saltwater pool, whirlpool, state-of-the-art fitness center with Peloton bikes, arcade/game room, and proximity to Apex Entertainment complex.",Embassy Suites by Hilton,230,5,"3,020",728,Boston Logan International Airport (BOS),https://www.hilton.com/en/hotels/bosmaes-embassy-suites-boston-marlborough/,,45 minutes from BOS,60,"Sep-Oct, May-Jun","Jan-Feb, Jul-Aug",All-suite accommodations centered around a lush indoor tropical atrium,Frequent noise and elevator congestion from youth sports teams taking over the lobby,2,604,Serious/Academic | High-Energy/Buzzing | Athletic/Active,"Catering to local corporate parks with functional meeting facilities and all-suite accommodations for business travelers (Serious), this property frequently transforms into a lively, bustling hub driven by youth sports tournaments (High-Energy), leaning into this demographic with specialized amenities like a designated knee-hockey room, an expanded fitness center with Peloton bikes, and close proximity to the New England Sports Center (Athletic)."
Gilchrist Club,Trenton,Florida,"A 27,000-acre private membership hunting and fishing preserve offering elite wilderness escapes, five-star hospitality, and specialized group meeting facilities in a tranquil forest setting.","World-class quail, turkey, and deer hunting, bass and crappie fishing, sporting clays, tomahawk throwing, wild pig hunting, and dining at Suwannee Lake Lodge.",Benchmark Resorts & Hotels,28,1,800,"2,200",Gainesville Regional Airport (GNV),https://www.gilchristclub.com/,,45 minutes from GNV,60,May-August is the only season they accept business,May-August is the only season they accept business,They show the hunting and fishing capabilities. They also have a nice dining room for groups to eat after the activities.,"This is a private club, they normally turn business away unless you are in the club, unless it is May-August and they are extremely slow.",5,800,Secluded/Private | Athletic/Active | Luxury/Pampering,"Spanning 27,000 acres of untamed Florida wilderness, this highly exclusive, gated sanctuary provides a hushed, retreat-like environment with private lodge accommodations for total isolation (Secluded), serves as a premier destination for elite outdoorsmen featuring world-class wing shooting, a 1,000-yard rifle range, and trophy bass fishing (Athletic), and maintains a ""refined rustic"" standard of service with personal guides, gourmet wild-game dining, and high-end hospitality (Luxury)."
Hammock Beach Golf Resort & Spa,Palm Coast,Florida,"Nestled along a pristine stretch of Florida's Atlantic Coast, this premier oceanfront destination offers sophisticated coastal accommodations, including ocean-view suites and villas, just minutes from historic St. Augustine.","91,000-sq.-ft. water park with a lazy river and water slide, two signature golf courses (Jack Nicklaus Ocean Course and Tom Watson Conservatory Course), full-service spa, tennis and pickleball center, and a 209-slip marina.",Benchmark Resorts & Hotels,275,15,"50,000","7,122",Daytona Beach International Airport (DAB),https://www.hammockbeach.com/,,30 minutes from DAB,500,March-August,September-November,Golf Course on the beach,The units are older since the property has been around for a while.,4,3333,Athletic/Active | Wellness/Zen | Public/See-and-be-Seen,"Renowned as a premier golf destination, this resort features two championship courses—including the oceanfront Ocean Course and the Conservatory Course—alongside a massive nine-pool water park and professional tennis facilities (Athletic), while offering a tranquil escape through its full-service spa and miles of serene, pink-sand Atlantic coastline (Wellness), and serving as a high-profile social anchor for the Palm Coast where the multi-level pool deck and various dining venues create a lively, community-focused atmosphere (Public)."
Hanover Inn Dartmouth,Hanover,New Hampshire,"A historic boutique hotel founded in 1780, located directly on the Dartmouth College campus overlooking the Green, blending New England legacy with modern conference facilities.","24-hour fitness center, on-site dining at PINE, access to Dartmouth Skiway, ice skating on Occom Pond, and walking distance to the Hood Museum of Art and Dartmouth athletics.",Preferred Hotels & Resorts,108,10,"11,000","4,000",Lebanon Municipal Airport (LEB),https://www.hanoverinn.com,,15 minutes from LEB,300,Spring/Fall,Winter/Summer,Ballroom floor to ceiling windows,Not enough meeting space,3,1100,Serious/Academic | Historic Charm | Public/See-and-be-Seen,"Functioning as the historic ""front door"" to Dartmouth College with dedicated conference facilities (Serious), this centuries-old New England landmark (Historic) serves as the primary high-profile social and networking hub for visiting alumni, academics, and locals, anchored by its prominent PINE restaurant (Public)."
