Hilton Birmingham at UAB,Birmingham,Alabama,"Located on the UAB campus in the heart of the Medical District, this hotel recently completed a multimillion-dollar renovation of all guest rooms and event spaces, offering a contemporary retreat for medical, academic, and business travelers.","Outdoor seasonal pool, 24-hour fitness center with Peloton bikes, on-site dining at Blazer’s Grill, a lobby Starbucks, and complimentary shuttle service to the airport and local area.",Hilton Hotels & Resorts,295,9,"16,000","7,150",Birmingham-Shuttlesworth International Airport (BHM),https://www.hilton.com/en/hotels/bhmhhhh-hilton-birmingham-downtown-uab/,,15 minutes from BHM,600,"Mar-May, Sep-Oct","Nov-Jan, Jul-Aug",Connected directly to UAB Hospital via a convenient climate-controlled pedestrian skybridge,Confusing attached municipal parking garage layout with frequent elevator delays and bottlenecks,3,1778,Serious/Academic | Modern/Industrial | Public/See-and-be-Seen,"Positioned as the primary gateway to the University of Alabama at Birmingham (UAB) and the surrounding medical district, this property functions as a core academic hub for clinical conferences and university-affiliated events with nearly 15,000 square feet of pillar-free meeting space (Serious), features a recently updated, contemporary interior optimized for corporate efficiency and ""heads down"" productivity (Modern), and serves as a highly visible local networking anchor through its buzzy social scene at The LAB Bar & Kitchen, which attracts a steady flow of medical professionals, visiting academics, and local residents (Public)."
Hilton Philadelphia Penn’s Landing,Philadelphia,Pennsylvania,"A premier waterfront hotel located at Penn's Landing, featuring panoramic views of the Delaware River and easy access to the Historic District and Independence Hall.","Indoor pool, 24-hour fitness center, seasonal sundeck, waterfront dining, adjacent to Spruce Street Harbor Park, and walking distance to Old City attractions.",Hilton Hotels & Resorts,350,19,"23,837","7,656",Philadelphia International Airport (PHL),https://www.hilton.com/en/hotels/phlpnhh-hilton-philadelphia-at-penns-landing/,,15 minutes from PHL,"1,100","April-May, August-October",mid October-November,Water side view,Parking fees,3,1255,Serious/Academic | High-Energy/Buzzing | Public/See-and-be-Seen,"Functioning as a major conference hub with 24,000 square feet of event space (Serious), this property leverages its unique position as Philadelphia's only waterfront hotel to immerse guests in the bustling atmosphere of Penn's Landing (High-Energy), while its prominent waterfront restaurant and prime location create a highly visible social anchor for the city (Public)."
Hilton University of Florida Conference Center Gainesville,Gainesville,Florida,"An IACC-certified conference center hotel located on the University of Florida campus, featuring Mediterranean-style architecture and sophisticated spaces for academic, business, and social events.","Outdoor pool and whirlpool, 24-hour fitness center, on-site dining at Albert's Restaurant and No Name Lounge, 24-hour business center, and campus shuttle service.",Hilton Hotels & Resorts,248,3,"25,000","6,860",Gainesville Regional Airport (GNV),https://www.hilton.com/en/hotels/gvncchf-hilton-university-of-florida-conference-center-gainesville/,,15 minutes from GNV,700,February- April,Summer time,"Unique rooms, only place in the city that is full service, welcome reception space","Isolated from the main area of town, hard to get out!",3,8333,Serious/Academic | Modern/Industrial | Wellness/Zen,"Positioned on the edge of the UF campus, this property functions as a primary academic and research hub with over 25,000 square feet of IACC-certified meeting space and a dedicated 13-seat executive boardroom (Serious), features a contemporary, streamlined design tailored for ""heads down"" productivity and large-scale university conferences (Modern), and offers a unique natural escape due to its location directly adjacent to the Kanapaha Botanical Gardens and Biven's Arm Nature Park (Wellness)."
"Hotel Adeline, Scottsdale",Scottsdale,Arizona,"A contemporary urban retreat in the heart of Old Town Scottsdale, featuring a high-energy vibe, mid-century modern architecture, and a central zero-edge pool that serves as the social centerpiece.","3,000-sq.-ft. zero-edge pool with private cabanas, ""Straight Up!"" speakeasy whiskey bar, ""Self-Made"" signature restaurant, ""Freestyle"" pool bar, fitness center, and outdoor lawn games.",Tribute Portfolio (Marriott),213,5,"10,115","4,800",Phoenix Sky Harbor International Airport (PHX),https://www.hoteladeline.com/,,20 minutes from PHX,300,Jan-Apr,Jun-Aug,"3,000-square-foot zero-edge pool with private cabanas and vibrant courtyard","Two-story motel conversion lacking elevators for upper floors, with paper-thin walls and noise issues",3,2023,Public/See-and-be-Seen | High-Energy/Buzzing | Modern/Industrial,"Positioned as a high-visibility social hub near Old Town, this property centers its identity around a 3,000-square-foot zero-edge pool that hosts a constant rotation of DJs and lively weekend parties (Public/High-Energy), while delivering a ""retro-mod"" boutique aesthetic through its midcentury design and hidden whiskey speakeasy (Modern)."
Hotel Eleo,Gainesville,Florida,"An upscale boutique hotel located on the University of Florida campus, featuring striking modern architecture, lakefront views, and high-end interior design tailored for both academic and medical visitors.","24-hour fitness center with high-end equipment, on-site dining at Covey Kitchen + Cocktails with lakeside views, valet parking, and a technology-forward ""Consulaire"" concierge service.",Independent (Managed by Pyramid Global),173,6,"1,100","1,150",Gainesville Regional Airport (GNV),https://www.hoteleleo.com/,,15 minutes from GNV,120,Jan-Apr,Jul-Aug,Sleek six-story boutique hotel overlooking Rush Lake located on the University of Florida campus,"Mandatory valet parking creates bottlenecks during large events, and room climate control is centrally locked",3,183,Modern/Industrial | Serious/Academic | Wellness/Zen,"Rising as a sleek, sinuous landmark on the University of Florida campus, this upscale boutique property blends a high-design aesthetic—featuring exposed concrete and custom Italian furnishings (Modern)—with a hyper-functional role as the primary ""home base"" for UF Health and the surrounding medical/academic hub (Serious). Despite its clinical proximity, the hotel prioritizes a ""refreshing refuge"" vibe with floor-to-ceiling lake views, a high-end fitness studio equipped with Peloton and TRX, and an outdoor yoga patio designed for mental decompression (Wellness)."
Hotel Flor by Tapestry,Tampa,Florida,"A historic 1926 Art Deco landmark in Downtown Tampa, recently renovated in 2023 to blend vintage charm with modern luxury, located just blocks from the Tampa Riverwalk and the Straz Center.","24-hour fitness center with Peloton bikes, complimentary shuttle service within a 3-mile radius, complimentary bicycle rentals, Cass Street Coffee Co., and on-site dining at The Dan.",Tapestry Collection by Hilton,210,4,"13,042","3,800",Tampa International Airport (TPA),https://www.hotelflortampa.com/,,15 minutes from TPA,250,Jan-Apr,Jul-Aug,Historic 1920s downtown hotel featuring original architectural charm and an elegant grand ballroom,"Expensive valet-only parking creates bottlenecks, and the historic layout causes frequent elevator delays",3,3261,Historic Charm | Modern/Industrial | Public/See-and-be-Seen,"Originally opened in 1926 as the Floridan, this 19-story Mediterranean Revival landmark preserves its deep storytelling through a meticulously restored grand lobby and its iconic rooftop sign (Historic), while undergoing a comprehensive multi-million dollar renovation that integrates high-end, contemporary finishes and tech-forward amenities (Modern). The property serves as a central social anchor in downtown Tampa, driven by the ""see-and-be-seen"" energy of the legendary Sapphire Lounge—a historic jazz-age staple—and its proximity to the city's urban waterfront (Public)."
Hotel Indigo Cleveland Downtown,Cleveland,Ohio,"Centered in the vibrant Gateway District, this hotel offers a blend of historic theater-inspired design and modern energy, located directly across from Rocket Mortgage FieldHouse and Progressive Field.","24-hour fitness center, on-site dining at Headliner Bar & Eatery, rooftop terrace, business center, and pet-friendly accommodations.",Hotel Indigo (IHG),143,4,"2,948","2,100",Cleveland Hopkins International Airport (CLE),https://www.ihg.com/hotelindigo/hotels/us/en/cleveland/clehr/hoteldetail,,20 minutes from CLE,100,"Sep-Oct, May-Jun","Jan-Feb, Jul-Aug",Historic boutique property steps away from major downtown sports and entertainment venues,"Expensive valet-only parking creates bottlenecks, and downtown location leads to frequent loud street noise",2,737,Modern/Industrial | Serious/Academic | Public/See-and-be-Seen,"Branded as a ""modern Hollywood Regency"" boutique, this property blends a bold monochromatic palette and brass accents with industrial touches like black-washed brick walls and vintage sports-themed murals (Modern/Industrial). It functions as a primary hub for corporate travelers and mid-sized groups with nearly 3,000 square feet of dedicated meeting space (Serious), while its ""Headliners"" bar and prime location—directly across from Rocket Mortgage Fieldhouse and Progressive Field—make it a high-visibility social anchor for the Gateway District's sports and concert crowd (Public)."
Hotel Lucia,Portland,Oregon,"A luxurious boutique hotel in downtown Portland known for its extensive photography collection, eclectic art, and historic 1909 architecture, providing an artful and creative urban escape.","24-hour fitness center (Well+Fit), complimentary nightly craft beer hour, arcade and board game library, complimentary bicycles, and pet-friendly ""VIP"" treats.",Independent (Managed by Pyramid Global),127,3,"2,532","1,100",Portland International Airport (PDX),https://www.hotellucia.com/,,20 minutes from PDX,100,Jun-Aug,Nov-Jan,Historic downtown hotel featuring a world-class photography collection and nightly craft beer hour,"Small, slow elevators create bottlenecks for groups and expensive valet-only parking is a persistent friction point",3,844,Historic Charm | Modern/Industrial | Public/See-and-be-Seen,"Originally built in 1909 as the Imperial Hotel, this landmark property is steeped in storytelling and listed on the National Register of Historic Places (Historic). It seamlessly blends its classical exterior with a world-class collection of black-and-white photography and sleek, minimalist furnishings (Modern). The hotel functions as a high-visibility creative hub in the heart of downtown Portland, anchored by its proximity to the city’s culinary heavyweights and a vibrant lobby scene that draws a consistent crowd of artists and professionals (Public)."
Hotel Max,Seattle,Washington,"A boutique design hotel in downtown Seattle known for its extensive art collection (including an original Warhol), music-inspired ""Sub Pop"" floor with turntables, and a high-energy, creative atmosphere.","24-hour fitness center with Peloton bikes, daily craft beer hour in the lobby, ""Paige"" virtual concierge, bicycle rentals, pet-friendly ""spiritual menu,"" and on-site culinary partnerships.",Independent (Managed by Pyramid Global),163,3,"6,600",650,Seattle-Tacoma International Airport (SEA),https://www.hotelmaxseattle.com/,,20 minutes from PDX,40,Jun-Aug,Nov-Jan,Pop-culture themed boutique hotel featuring sub-pop records and locally-sourced artwork,Single small elevator bank creates significant bottlenecks and no on-site parking available,3,2200,Modern/Industrial | High-Energy/Buzzing | Public/See-and-be-Seen,"Positioned as a premier creative sanctuary in downtown Seattle, this boutique property features an extensive collection of original local art and a unique partnership with Sub Pop Records (Modern/Industrial), while serving as a high-visibility social anchor driven by its legendary daily craft beer hour and the ""Artist Loft""—a 6,300-square-foot raw, versatile event space with a car elevator that attracts a vibrant crowd of influencers and industry professionals (High-Energy/Public)."
Hotel Murano,Tacoma,Washington,"An art-centric luxury hotel in downtown Tacoma featuring a museum-quality glass art collection with works from 45 artists across 12 countries, offering panoramic views of Mount Rainier and the Puget Sound.","Curated glass art collection, 24-hour fitness center with Peloton bikes (Well+Fit program), ""Paige"" virtual concierge, BITE restaurant and BAR960, bicycle rentals, and pet-friendly ""VIP"" perks.",Independent (Managed by Pyramid Global),319,26,"28,000","13,200",Seattle-Tacoma International Airport (SEA),https://www.hotelmuranotacoma.com/,,25 minutes from SEA,"1,000",Jun-Sep,Nov-Mar,Boutique glass-art themed hotel showcasing a massive international collection of hand-blown glass,"Only three elevators serving a 25-story tower, resulting in significant congestion during group check-outs",3,1077,Modern/Industrial | Serious/Academic | Public/See-and-be-Seen,"Positioned as a ""living art gallery"" in the heart of downtown Tacoma, this high-design property showcases an international collection of studio glass art (Modern), while serving as the South Sound’s premier convention destination with 30,000 square feet of versatile event space, including the expansive Bicentennial Pavilion (Serious). Its dramatic, museum-worthy lobby and proximity to the city's cultural district make it a high-visibility social and corporate anchor for the region (Public)."
"Hotel Paradox, Autograph Collection",Santa Cruz,California,"An ""urban forest"" boutique retreat featuring reclaimed wood decor, a vibrant social scene, and a mid-century modern aesthetic, located within walking distance of downtown Santa Cruz and the Beach Boardwalk.","Outdoor heated pool with private cabanas and fire pits, poolside bar and restaurant (ALTO), 24-hour fitness center, complimentary bicycle rentals, and pet-friendly accommodations.",Autograph Collection (Marriott),170,10,"8,000","4,300",San Jose Mineta International Airport (SJC),https://www.hotelparadox.com/,,45 minutes from SJC,400,May-Oct,Nov-Feb,Urban-forest aesthetic with reclaimed wood decor and a poolside bar and fire pits,Limited and expensive on-site parking and significant noise bleed from the pool area,3,800,Novelty/Themed | Public/See-and-be-Seen | High-Energy/Buzzing,"Designed around the concept of ""expect the unexpected,"" this property blurs the line between the rugged Santa Cruz mountains and urban sophistication, featuring an immersive ""nature-meets-neon"" aesthetic anchored by a massive 15,000-pound eucalyptus log front desk (Novelty/Themed). It serves as a primary social anchor for the city, driven by the high-visibility energy of its vibrant pool deck and ""The Solaire"" restaurant, which frequently host lively weekend events and a consistent crowd of locals and travelers (Public/High-Energy)."
Hotel Valley Ho,Scottsdale,Arizona,"Originally opened in 1956 and a former hideaway for Hollywood icons, this mid-century modern landmark in Old Town Scottsdale features vibrant design, floor-to-ceiling glass, and a classic desert-cool atmosphere.","Two signature pools (OH Pool and OHasis Pool), full-service VH Spa, 24-hour high-tech fitness center and movement studio, on-site dining at ZuZu, and the panoramic Sky Line Rooftop with 360-degree views.",Independent (Managed by Pyramid Global),241,17,"40,646","3,850",Phoenix Sky Harbor International Airport (PHX),https://www.hotelvalleyho.com/,,15 minutes from PHX,500,Jan-Apr,Jun-Aug,"Mid-century modern architectural landmark with a vibrant, Hollywood-inspired pool scene",No elevators in the original two-story wings and significant noise bleed from the pool,4,2391,Historic Charm | Novelty/Themed | Public/See-and-be-Seen,"Originally opened in 1956 and designed by Edward L. Varney, this mid-century modern icon is a masterclass in architectural storytelling and Hollywood-era nostalgia (Historic). It leans completely into its ""classically cool"" aesthetic, from the retro-chic Tower suites to the vibrant, 1950s-inspired ZuZu restaurant (Novelty/Themed), while serving as a high-visibility social anchor in Old Town Scottsdale—driven by the high-energy ""OH Pool"" scene and its rooftop terrace that draws a consistent crowd of trendsetters and locals (Public)."
Inn at Perry Cabin,St. Michaels,Maryland,"A historic boutique waterfront resort on the Miles River with a nautical heritage dating to 1816, featuring lush gardens and a sophisticated Chesapeake Bay atmosphere (famously the setting for ""Wedding Crashers"").","Links at Perry Cabin (Pete Dye-designed golf course), full-service luxury spa, zero-edge infinity pool, a fleet of five sailboats and a 55-foot Hinckley yacht, tennis courts, and complimentary kayaks and paddleboards.",Independent (Managed by Pyramid Global),78,5,"6,443","1,536",Baltimore/Washington International Airport (BWI),https://www.innatperrycabin.com/,,90 minutes from BWI,180,May-Oct,Nov-Mar,"Historic luxury estate on the Miles River famously featured in ""Wedding Crashers""",Sprawling 26-acre layout with multiple separate buildings requires significant outdoor walking between venues,5,1289,Historic Charm | Luxury/Pampering | Secluded/Private,"Steeped in history dating back to 1812 and famously serving as the backdrop for ""Wedding Crashers,"" this Eastern Shore landmark offers deep storytelling through its nautical heritage and colonial architecture (Historic). The resort provides a top-tier, high-touch experience featuring a full-service spa, a Pete Dye-designed golf course, and a fleet of luxury yachts and sailboats (Luxury), all situated on 26 secluded acres of manicured gardens and shoreline that create a hushed, retreat-like atmosphere (Secluded)."
InterContinental Seattle Bellevue at The Avenue,Bellevue,Washington,"The first InterContinental property in the Pacific Northwest, this luxury hotel is a centerpiece of the Avenue Bellevue complex, blending modern Feng Shui design with upscale retail and residential spaces in the heart of downtown.","Full-service spa and beauty salon, Les Clefs d'Or-certified concierge, 24-hour fitness center, CE LA VI cocktail lounge, signature dining by Iron Chef Masaharu Morimoto, and a covered outdoor terrace.",InterContinental Hotels (IHG),208,9,"11,756","4,272",Seattle-Tacoma International Airport (SEA),https://www.ihg.com/intercontinental/hotels/us/en/bellevue/seaha/hoteldetail,,25 minutes from SEA,420,Jun-Sep,Nov-Mar,Sophisticated luxury within the prestigious Avenue mixed-use development featuring world-class dining and retail,High valet costs and confusing street-level access to the hotel lobby,4,1306,Luxury/Pampering | Modern/Industrial | Serious/Academic,"Marking the brand's debut in the Pacific Northwest, this 5-star high-rise within the $1B+ Avenue Bellevue complex offers a hyper-refined urban experience featuring Les Clefs d’Or concierge service and a luxury car chauffeur (Luxury), while delivering a sleek, ""Feng Shui-inspired"" aesthetic across its 208 rooms and designer shopping enclave (Modern). The property functions as a premier business hub with a dedicated 12,000-square-foot conference center—connected by a sky bridge—that features nine multi-functional rooms designed for high-profile privacy and corporate precision (Serious)."
La Quinta Resort & Club,La Quinta,California,"A historic 45-acre desert oasis established in 1926, featuring iconic Spanish-style casitas and a storied Hollywood heritage set against the backdrop of the Santa Rosa Mountains.","41 climate-controlled swimming pools, 53 whirlpool spas, 21 tennis courts, 8 pickleball courts, 5 championship golf courses, the full-service Spa La Quinta, and seven on-site dining options.",Curio Collection by Hilton,796,45,"190,000","16,940",Palm Springs International Airport (PSP),https://www.laquintaresort.com/,,35 minutes from PSP,"2,000",Jan-Apr,Jun-Aug,45-acre historic desert oasis featuring 41 pools and 5 championship golf courses,Sprawling layout with disjointed buildings requires extensive walking and outdoor navigation for group movements,4,4222,Historic Charm | Athletic/Active | Secluded/Private,"Originally opened in 1926 as a desert retreat for Hollywood’s elite, this Waldorf Astoria property offers deep architectural storytelling through its iconic white-washed casitas and terracotta-tiled roofs (Historic). It serves as a premier global destination for sports enthusiasts, featuring five championship golf courses—including the legendary PGA WEST Stadium Course—and a world-class tennis center with 23 courts (Athletic), while its expansive 45-acre layout, dotted with 41 individual pools and quiet courtyards, maintains a hushed, bungalow-style atmosphere for total isolation (Secluded)."
Lake Arrowhead Resort & Spa,Lake Arrowhead,California,"Nestled in the San Bernardino National Forest at an elevation of 5,174 feet, this lakeside retreat offers a mountain escape with a mix of rustic charm and modern luxury, providing exclusive access to a private lake beach.","Private lake beach and dock, full-service ""Spa of the Pines,"" heated outdoor pool and hot tubs, fitness studio, on-site dining at BIN189, and seasonal mountain activities like hiking and skiing.",Autograph Collection (Marriott),173,14,"23,000","4,004",San Bernardino International Airport (SBD),https://www.lakearrowheadresort.com/,,70 minutes from ONT,450,Jun-Aug,"Apr-May, Oct-Nov",Private lakeside beach and marina access with panoramic mountain views,Parking is across a busy road and elevators are small and slow,4,1643,Secluded/Private | Wellness/Zen | Athletic/Active,"Nestled deep within the San Bernardino National Forest at an elevation of 5,100 feet, this lakeside sanctuary offers a hushed, retreat-like environment defined by its private beach access and quiet alpine surroundings (Secluded). The property functions as a primary hub for mental and physical restoration, anchored by the full-service ""Spa of the Pines"" and its focus on mountain-inspired wellness treatments (Wellness), while serving as a gateway to high-altitude recreation including lake excursions, nearby hiking trails, and seasonal mountain sports (Athletic)."
"MargaritaVille Lake Resort, Lake Conroe",Montgomery,Texas,"A Jimmy Buffett-inspired 186-acre waterfront paradise on Lake Conroe, featuring all-suite accommodations and a laid-back ""island"" atmosphere just an hour north of Houston.","Jolly Mon Water Park, Fins Up! Fitness Center, 18-hole golf course, St. Somewhere Spa, marina with boat rentals, private beach, and five signature Margaritaville-themed restaurants and bars.",Independent (Managed by Pyramid Global),335,20,"72,000","11,520",George Bush Intercontinental Airport (IAH),https://www.margaritavilleresorts.com/margaritaville-lake-resort-lake-conroe,,60 minutes from IAH,840,"Mar-May, Sep-Oct","Jan-Feb, Jul-Aug","84,000-square-foot conference center situated on a 186-acre waterfront resort with a water park and golf course","Sprawling layout with long distances between the main tower and conference center, and significant noise from the outdoor water park",3,3600,High-Energy/Buzzing | Serious/Academic | Athletic/Active,"Bringing Jimmy Buffett’s ""island state of mind"" to the shores of Lake Conroe, this resort functions as a high-energy playground featuring a 3.5-acre water park, private beach, and a rotating schedule of live music across its signature bars (High-Energy). While it leans heavily into its laid-back tropical theme, the property maintains a professional edge with a 72,000-square-foot IACC-certified conference center designed for ergonomic productivity and ""serious learning"" (Serious), and serves as a primary hub for recreation with its championship golf course, tennis courts, and extensive lakefront marina (Athletic)."
Marriott Boston Newton,Newton,Massachusetts,"Set on 22 acres of scenic riverfront land along the Charles River, this hotel offers comfortable accommodations and convenient access to major highways and downtown Boston.","Indoor swimming pool, health club fitness center, riverside walking paths, and outdoor patios.",Marriott Hotels,430,10,"31,590","9,324",Boston Logan International Airport (BOS),https://www.marriott.com/en-us/hotels/bosnt-boston-marriott-newton/overview/,,20 minutes from BOS,"1,200","March-June, September-mid November","January-February, July-August,","Customer service, client services and location (prime)",The building is dated,3,3159,Serious/Academic | Wellness/Zen,"Operating as a high-capacity suburban conference center and university-adjacent hub with over 20,000 square feet of meeting space (Serious), this property distinguishes itself from standard business hotels with its 22-acre scenic footprint along the Charles River, offering outdoor pavilions and riverside walking paths for decompression (Wellness)."
