Marriott Colorado Springs,Colorado Springs,Colorado,"A mountain-view hotel situated near the base of Pikes Peak, offering a mix of Southwestern charm and modern amenities, including easy access to the Garden of the Gods and the U.S. Air Force Academy.","Indoor and outdoor heated pools and hot tubs, 24-hour fitness center, on-site dining at Ascent Restaurant & Bar, complimentary local shuttle (within 3 miles), and a large outdoor function space.",Marriott Hotels,309,15,"24,001","7,128",Colorado Springs Airport (COS),https://www.marriott.com/en-us/hotels/cosmc-colorado-springs-marriott/,,20 minutes from COS,777,"Jun-Aug, Sep-Oct",Nov-Feb,"Pikes Peak mountain views from many guest rooms and over 24,000 square feet of versatile meeting space",Property is visibly aging with inconsistent housekeeping and frequent elevator reliability issues,3,1600,Serious/Academic | Modern/Industrial | Wellness/Zen,"Fresh off a $15 million renovation, this northwest Colorado Springs property serves as a major regional convention hub with over 24,000 square feet of versatile meeting space and 15 breakout rooms (Serious). The interior design, crafted in partnership with Wright Heerema Architects, delivers a sleek, updated aesthetic inspired by the ""MC2"" standard, featuring custom artwork and textures that reflect the local geological landscape (Modern). Despite its high-efficiency corporate focus, the resort leans into its proximity to the Rocky Mountains and Garden of the Gods with an expansive outdoor courtyard, a seasonal pavilion, and the ""Ascent"" restaurant, providing a sense of alpine rejuvenation for group travelers (Wellness)."
Marriott Fort Lauderdale North,Fort Lauderdale,Florida,"Located near the Cypress Creek Nature Preserve and the business district, offering a relaxed setting with stylish accommodations and easy access to Pompano Beach.","Rooftop pool with cabanas, whirlpool, 24-hour fitness center, and on-site dining including The Preserve.",Marriott Hotels,315,19,"26,745","5,082",Fort Lauderdale-Hollywood International Airport (FLL),https://www.marriott.com/en-us/hotels/fllcc-fort-lauderdale-marriott-north/overview/,,20 minutes from FLL,700,January-April,July-September,Convention space/Free parking garage/Rooftop pool,No shuttle to the airport,3,1408,Serious/Academic | Modern/Industrial,"Situated near the Cypress Creek Business Park with nearly 27,000 square feet of event space, this property caters heavily to a ""heads down"" corporate and transient clientele (Serious), providing a highly functional, contemporary environment optimized for travel efficiency rather than leisure excess (Modern)."
Marriott Houston Westchase,Houston,Texas,"An upscale hotel located in the heart of the Westchase District and Energy Corridor, featuring contemporary Texas-themed decor and extensive event facilities suited for large-scale corporate and social gatherings.","Indoor and outdoor heated swimming pools, 24-hour state-of-the-art fitness center, M Club lounge, on-site Starbucks, and the Republic Grill & Lounge.",Marriott Hotels,604,21,"43,000","9,336",William P. Hobby Airport (HOU),https://www.marriott.com/en-us/hotels/houwm-houston-marriott-westchase/overview/,,35 minutes from IAH,"1,000","Feb-May, Sep-Nov","Jul-Aug, Dec-Jan","Over 43,000 square feet of flexible ground-floor meeting space including a dedicated 15,000-square-foot exhibit center","Dated property with inconsistent room cleanliness and some ""upgraded"" suites bizarrely lacking standard desks or dressers",3,2048,Serious/Academic | Modern/Industrial | Public/See-and-be-Seen,"Positioned as a major corporate pillar in the Westchase Business District, this property functions as a heavy-hitting convention hub with nearly 40,000 square feet of flexible meeting space, all conveniently located on a single level for maximum event flow (Serious). Following a comprehensive $20 million ""studs-up"" renovation, the hotel delivers a sleek, updated aesthetic featuring the brand’s latest room packages and a tech-forward M Club lounge designed for high-efficiency business travelers (Modern). Its expansive lobby and ""Republic"" social spaces serve as a high-visibility networking anchor for the surrounding Energy Corridor, drawing a consistent crowd of corporate professionals and local stakeholders (Public)."
Marriott Phoenix Chandler,Chandler,Arizona,"Opened in 2019 as the newest full-service hotel in the Southeast Valley's tech hub, this contemporary property features a sleek, modern design tailored for business and conference travelers in the Price Road Corridor.","Outdoor pool and sun deck, M Club Lounge, 24-hour fitness center with Peloton bikes, on-site dining at Proof 19 (Southwest cuisine) and Proof 19 Bar, a lobby Starbucks, and complimentary on-site parking.",Marriott Hotels,264,22,"30,550","10,100",Phoenix Sky Harbor International Airport (PHX),https://www.marriott.com/en-us/hotels/phxml-marriott-phoenix-chandler/overview/,,15 minutes from PHX,"1,000",Jan-Apr,Jul-Aug,"Modern full-service property opened in 2019; currently the newest Marriott in the state with over 30,000 square feet of space","Frequent complaints regarding rude restaurant and bar staff, inconsistent hot water, and noise bleed from upper floors",3,1389,Serious/Academic | Modern/Industrial | Public/See-and-be-Seen,"As the largest Marriott in Arizona by meeting square footage, this property functions as a dominant regional convention powerhouse with over 28,000 square feet of flexible event space, including the expansive 10,000-square-foot Gila Ballroom (Serious). The design is sleek and tech-forward, featuring the brand's signature ""Greatroom"" lobby and a sophisticated M Club designed for maximum corporate productivity (Modern). Its centralized location in the Price Road Corridor—Arizona's ""Silicon Desert""—makes it a high-visibility social and networking anchor for tech executives and local business leaders (Public)."
Marriott Pittsburg Airport,Coraopolis,Pennsylvania,"A newly renovated hotel located minutes from Pittsburgh International Airport, featuring modern residential-style design, a beautiful outdoor courtyard, and versatile event venues.","Indoor pool, state-of-the-art fitness center, outdoor courtyard with a fire sculpture, on-site dining at Runner Stone Mill House, and a lobby Starbucks.",Marriott Hotels,317,17,"12,639","4,840",Pittsburgh International Airport (PIT),https://www.marriott.com/en-us/hotels/pitmc-pittsburgh-airport-marriott/overview/,,10 minutes from PIT,650,Spring/Fall,Winter/Summer,"Great room Lobby, Outdoor courtyard, M Club",Proximity to the airport is convenient for travel but may result in noticeable aircraft noise during peak flight hours.,2,743,Serious/Academic | Modern/Industrial,"Operating as a primary transit and corporate meeting hub with extensive event space, this airport-adjacent property caters heavily to ""heads down"" business travelers (Serious), featuring a sleek, functional interior designed for high-efficiency layovers and corporate gatherings (Modern)."
Marriott Pittsburg North,Cranberry Township,Pennsylvania,"The only full-service hotel in Cranberry Township, located within the Cranberry Woods Business Park; recently renovated (2021) with a modern Greatroom, M Club lounge, and upscale amenities tailored for the North Hills business corridor.","Indoor heated pool, 24-hour fitness center, M Club Lounge (concierge level), on-site dining at RC Grille, a lobby Starbucks coffee bar, 24-hour business center, and complimentary on-site parking.",Marriott Hotels,298,13,"11,997","7,480",Pittsburgh International Airport (PIT),https://www.marriott.com/en-us/hotels/pitno-pittsburgh-marriott-north/overview/,,30 minutes from PIT,940,"Sep-Oct, May-Jun","Jan-Feb, Jul-Aug","Over 13,000 square feet of modern meeting space located in the Cranberry business district","Reports of outdated bathroom fixtures, inconsistent hot water, and noise from the nearby highway",2,923,Serious/Academic | Modern/Industrial | Public/See-and-be-Seen  ,"Located in the heart of Cranberry Woods Business Park, this property functions as a dominant suburban convention hub with over 13,000 square feet of versatile meeting space, specifically designed to handle large-scale corporate trainings and regional association meetings (Serious). The hotel features the brand’s signature ""Greatroom"" lobby—a multi-functional, tech-enabled space that serves as both a ""heads down"" workspace and a high-visibility social anchor for the surrounding business district (Modern/Public). Its proximity to major regional corporate headquarters like Westinghouse makes it a primary networking pillar for North Pittsburgh professionals (Public)."
Marriott Pleasanton,Pleasanton,California,"A contemporary hotel in the Tri-Valley business corridor, recently renovated to feature a ""Lobby Reinvented"" design and upscale accommodations, located just steps from the Dublin/Pleasanton BART station for easy access to San Francisco.","Outdoor pool and whirlpool oasis, 24-hour fitness center, M Club lounge, on-site dining at Lone Oak Kitchen + Bar, complimentary shuttle service within a five-mile radius, and a 24-hour business center.",Marriott Hotels,245,3,"4,175","3,200",Oakland International Airport (OAK),https://www.marriott.com/en-us/hotels/oakmc-pleasanton-marriott/overview/,,25 minutes from OAK,350,"Mar-May, Sep-Oct","Dec-Feb, Jul-Aug",Convenient Tri-Valley location with walking distance to the West Pleasanton BART station and Stoneridge Mall,Guest rooms and bathrooms showing significant signs of wear and tear alongside frequent complaints about thin walls,3,1392,Serious/Academic | Modern/Industrial | Public/See-and-be-Seen  ,"Situated at the crossroads of I-580 and I-680 in the Tri-Valley, this property functions as a primary corporate hub for East Bay business, offering over 14,000 square feet of versatile meeting space and a dedicated 24-hour business center (Serious). Following a significant update, the hotel features the brand’s contemporary guest room design and a sleek, open-concept ""Greatroom"" lobby that facilitates both collaborative work and social networking (Modern). Its location adjacent to the Stoneridge Shopping Center and major business parks like Hacienda makes it a high-visibility social and professional anchor for local executives and regional travelers (Public)."
Marriott San Antonio Northwest,San Antonio,Texas,"Strategically located near the South Texas Medical Center, this full-service hotel offers a sophisticated home base for medical, corporate, and leisure travelers, featuring a contemporary Greatroom and versatile indoor-outdoor event spaces.","Outdoor swimming pool and terrace, 24-hour fitness center, M Club Lounge, on-site dining at Asador Restaurant & Bar, complimentary airport shuttle, and free local shuttle service (3-mile radius).",Marriott Hotels,297,9,"11,000","6,084",San Antonio International Airport (SAT),https://www.marriott.com/en-us/hotels/satnw-san-antonio-marriott-northwest-medical-center/overview/,,15 minutes from SAT,600,"Mar-May, Sep-Oct","Dec-Feb, Jul-Aug","Over 9,000 square feet of versatile space located in the heart of the San Antonio Medical Center district","Aging property with frequent reports of thin walls, dated bathroom fixtures, and inconsistent room cleanliness",3,1222,Serious/Academic | Modern/Industrial | Public/See-and-be-Seen  ,"Positioned at the gateway to the South Texas Medical Center and the USAA corporate corridor, this property functions as a primary hub for healthcare symposia and high-stakes corporate training with over 13,000 square feet of versatile, tech-equipped event space (Serious). Following a comprehensive renovation, the hotel features the brand’s signature ""Greatroom"" lobby and ""elevated"" guest rooms that prioritize a clean, minimalist aesthetic optimized for executive travelers (Modern). Its centralized location makes it a high-visibility social anchor for the region, where the ""Asado Urban Grill"" serves as a primary networking pillar for local medical professionals and business leaders (Public)."
Marriott Spartanburg,Spartanburg,South Carolina,"Located in the heart of downtown Spartanburg, this full-service conference hotel is integrated with the city's business and academic life, offering a blend of traditional hospitality and expansive event facilities.","Seasonal outdoor pool and whirlpool, 24-hour fitness center, M Club Lounge, on-site dining at Sparks Fire-Inspired Grille, Terrace on N. Church (outdoor dining), a lobby Starbucks, and the Mesh lounge.",Marriott Hotels,247,25,"29,604","11,340",Greenville-Spartanburg International Airport (GSP),https://www.marriott.com/en-us/hotels/spamc-spartanburg-marriott/overview/,,20 minutes from GSP,"1,500","Mar-May, Sep-Oct","Jan-Feb, Jul-Aug","Prominent downtown anchor featuring over 29,000 square feet of meeting space and a club-grade fitness center with a sauna","Inconsistent front desk service, dated bathroom fixtures in older wings, and surprising parking fees for the market",3,1184,Serious/Academic | Modern/Industrial | Public/See-and-be-Seen,"Functioning as the dominant convention anchor in Upstate South Carolina, this property provides massive utility with nearly 30,000 square feet of IACC-certified event space, including the 1,500-capacity Heritage Ballroom (Serious). The design reflects a crisp, corporate-modern aesthetic with tech-forward ""Greatroom"" hubs and specialized breakout rooms (Modern), while its downtown location and proximity to the Chapman Cultural Center and local universities make it a high-visibility social pillar for the city's business and academic community (Public)."
Mountain Shadows,Paradise Valley,Arizona,"A desert icon originally opened in 1959 and completely rebuilt in 2017, this luxury boutique resort blends mid-century modern design with contemporary minimalism, offering breathtaking views of Camelback Mountain and Mummy Mountain.","The Short Course (18-hole par-3 golf course), two 75-foot connecting pools (The Citizens Club), high-tech fitness center and juice bar, on-site dining at Hearth '61, and the scenic Camelback Overlook rooftop deck.",Independent (Managed by Pyramid Global),183,11,"12,500","4,500",Phoenix Sky Harbor International Airport (PHX),https://www.mountainshadows.com/,,20 minutes from PHX,400,Jan-Apr,Jun-Aug,Ultra-modern boutique resort with floor-to-ceiling glass walls offering iconic views of Camelback Mountain,Limited indoor meeting space for larger breakout needs and significant noise bleed from the central pool deck,4,1136,Historic Charm | Modern/Industrial | Public/See-and-be-Seen,"Originally a 1950s celebrity retreat and completely rebuilt in 2017, this Paradise Valley icon blends its mid-century desert heritage (Historic) with a sleek, minimalist aesthetic featuring floor-to-ceiling glass and ""butterfly"" rooflines (Modern). The property serves as a high-visibility social anchor, driven by the ""Rusty’s"" patio and the high-energy ""Citizens Club"" pool scene that attracts a consistent crowd of locals and trendsetters against the backdrop of Camelback Mountain (Public)."
Naples Grande Beach Resort,Naples,Florida,"A premier eco-smart beach resort set on 23 waterfront acres adjoining an estuary and the Gulf of Mexico, featuring panoramic water views from nearly every guest room and a sophisticated, contemporary Florida vibe.","Three outdoor pools (including the Mangrove Mountain waterslide pool), a private beach accessible via an open-air tram through a mangrove preserve, 15 championship tennis courts, the full-service Spa at Naples Grande, and an 18-hole par-72 championship golf course.",Independent (Managed by Pyramid Global),474,30,"83,000","14,442",Southwest Florida International Airport (RSW),https://www.naplesgrande.com/,,40 minutes from NAP,"1,660",December-April,June - September,"Beach access, Tennis and Golf Clubs, Large Ballroom",8/10ths of a mile from the beach. Not a true beach front property although it provides very close access.,4,2767,Serious/Academic | Luxury/Pampering | Athletic/Active,"Positioned as the premier convention powerhouse of Florida's Paradise Coast, this resort functions as a dominant business anchor with over 83,000 square feet of flexible meeting space, much of it conveniently situated on a single level for high-efficiency corporate flow (Serious). While it maintains a professional edge with IACC-certified facilities, the property leans into an upscale ""barefoot luxury"" identity, featuring a par-72 championship golf course, an award-winning tennis center with 15 Har-Tru courts, and a full-service ""Spa Village"" centered around organic and Eastern therapies (Luxury/Athletic). Its 23-acre waterfront setting within a protected mangrove estuary offers a high-end, independent vibe that balances heavy-hitting boardroom utility with a sophisticated coastal retreat (Serious/Luxury)."
OKANA Resort & Indoor Waterpark,Oklahoma City,Oklahoma,"A massive, $400-million world-class destination located adjacent to the First Americans Museum, designed to be a vibrant riverfront hub that celebrates the heritage of the Chickasaw Nation while offering high-energy family entertainment and sophisticated event spaces.","100,000-sq.-ft. indoor water park, 4.5-acre outdoor adventure lagoon, luxury spa and fitness center, 33,000-sq.-ft. family entertainment center, diverse on-site dining options, and a 1,500-seat amphitheater.",Benchmark Resorts & Hotels,404,18,"29,604","8,892",Will Rogers World Airport (OKC),https://okanaresort.com/,,15 minutes from OKC,"1,200",Mar-Aug,Nov-Jan,"Massive destination resort featuring a 100,000-square-foot indoor waterpark, multi-acre lagoon, and cultural proximity to the First Americans Museum",Significant noise from family-focused waterpark activities and premium destination pricing compared to standard downtown business hotels,3,1645,High-Energy/Buzzing | Novelty/Themed | Serious/Academic,"Positioned as a massive $400M+ ""escapist"" destination on the Oklahoma River, this property blends a high-energy ""island state of mind"" with a 100,000-square-foot indoor waterpark and a 4.5-acre outdoor adventure lagoon (High-Energy/Novelty). While it leans heavily into its tropical resort identity—complete with a swim-up bar, ziplines, and the ""OKANARAMA"" arcade—it functions as a heavy-hitting regional business anchor featuring a 27,000-square-foot state-of-the-art conference center and a 1,500-seat outdoor amphitheater (Serious/High-Energy). Its location adjacent to the First Americans Museum makes it a high-visibility cultural and social pillar for Oklahoma City’s tourism and corporate retreat markets (Public)."
Pullman Miami Airport Hotel,Miami,Florida,"An upscale, Art Deco-inspired hotel overlooking a sparkling blue lagoon, offering a sophisticated blend of French flair and Miami energy, located just minutes from the airport and downtown.","Outdoor heated pool with lagoon views, 24-hour fitness center, tennis courts, jogging trail, on-site dining at Tavolo (Mediterranean-inspired), Le Bar cocktail lounge, and complimentary 24-hour airport shuttle.",Accor (Managed by Pyramid Global),281,8,"11,000","2,800",Miami International Airport (MIA),https://www.pullmanmiamiairport.com/,,10 minutes from MIA,600,Jan-Apr,Jul-Sep,Sleek French-inspired upscale hotel overlooking a blue lagoon with refined dining and a stylish cocktail lounge,Visible wear and tear in guest rooms alongside frequent complaints regarding shuttle reliability and front desk responsiveness,3,1375,Modern/Industrial | Serious/Academic | Public/See-and-be-Seen,"Positioned as the first Pullman address in North America, this property reclaimed the former Sofitel and underwent a comprehensive transformation to blend European-inspired elegance with a vibrant, cosmopolitan Miami spirit (Modern). The hotel functions as a high-utility business anchor with over 11,000 square feet of flexible meeting space, featuring ten rooms with natural lighting and a dedicated event specialist team for ""best-in-class"" corporate execution (Serious). Its three-story atrium lobby, home to the Mediterranean-inspired Tavolo and a stylish tapas bar, serves as a high-visibility social hub overlooking the Blue Lagoon, drawing a consistent crowd of international travelers and local professionals (Public)."
Rand Tower Hotel,Minneapolis,Minnesota,"An Art Deco landmark and former headquarters of aviator Rufus Rand, this restored 1929 skyscraper features elegant aviator-themed decor, sleek modern finishes, and seamless access to the Minneapolis Skyway System.","French-inspired dining at Blondette (rooftop), Bar Rufus in the lobby lounge, 24-hour fitness center, Mia (the virtual concierge), and pet-friendly accommodations.",Tribute Portfolio (Marriott),270,5,"3,000","2,156",Minneapolis–Saint Paul International Airport (MSP),https://www.randtowerhotel.com/,,20 minutes from MSP,80,"Jun-Aug, Sep-Oct",Nov-Mar,Art Deco landmark with aviator-themed decor and seamless Minneapolis Skyway access to the business district,"High valet parking costs ($55+), frequent complaints about baseboard heater noise, and long wait times during peak check-in",3,600,Historic Charm | Modern/Industrial | Public/See-and-be-Seen,"Originally built in 1929 as an Art Deco skyscraper for aviator Rufus Rand, this National Register landmark preserves its storytelling through aviation motifs, original terrazzo floors, and the iconic ""Wings"" sculpture (Historic). Following a $110 million transformation into a Tribute Portfolio boutique, the property blends this ""Roaring 20s"" elegance with sleek, contemporary finishes and tech-forward guest rooms (Modern). It serves as a high-visibility social anchor in downtown Minneapolis, anchored by the ""see-and-be-seen"" energy of Bar Rufus and the fifth-floor Blondette, which features a one-of-a-kind retractable glass roof for rooftop dining (Public)."
Renaissance Indianapolis North Hotel,Carmel,Indiana,"A sophisticated boutique-style hotel in the heart of the Meridian Corridor, blending modern artistic design with the local ""Carmel"" flair, featuring a vibrant lobby scene and a focus on creative discovery.","Indoor heated pool and whirlpool, 24-hour fitness center, Grille 39 (American cuisine and craft cocktails), lobby lounge with live music events, and a full-service business center.",Renaissance (Marriott),263,16,"15,000","6,500",Indianapolis International Airport (IND),https://www.marriott.com/en-us/hotels/indbr-renaissance-indianapolis-north-hotel/overview/,,35 minutes from IND,500,"May-Jun, Sep-Oct","Jan-Feb, Jul-Aug","Modern Carmel business district property featuring over 14,000 square feet of versatile space and a 2021 renovation","Polarizing ""see-through"" sliding glass bathroom doors with large gaps and lack of covered parking for winter weather",3,938,Serious/Academic | Modern/Industrial | Public/See-and-be-Seen,"Positioned as the primary upscale corporate anchor in the Meridian Business Corridor, this property functions as a heavy-hitting regional hub with over 14,000 square feet of sophisticated, tech-forward meeting space (Serious). Following a significant 2021 renovation, the design delivers a ""crisp and creative"" aesthetic inspired by the nearby Carmel Arts & Design District, featuring floor-to-ceiling glass and curated local art in its multi-functional ""Greatroom"" lobby (Modern). Its status as a high-visibility social pillar is driven by ""Grille 39"" and its reputation for sustainable cocktail programs, making it a central networking destination for the North Indianapolis and Carmel business communities (Public)."
Renaissance Newport Beach Hotel,Newport Beach,California,"A chic, lifestyle-focused hotel that embodies the casual-luxury coastal vibe of Orange County, featuring a redesigned ""Newport Nautical"" aesthetic and a lush outdoor garden that serves as a social centerpiece.","Rooftop pool and cabanas, 24-hour fitness center, tennis and pickleball courts, live music in the lobby, on-site dining at CURRENT Components & Collins, and a complimentary shuttle to John Wayne Airport and Fashion Island.",Renaissance (Marriott),444,21,"27,476","7,965",John Wayne Airport (SNA),https://www.marriott.com/en-us/hotels/snanb-renaissance-newport-beach-hotel/overview/,,5 minutes from SNA,800,"Mar-May, Sep-Oct","Dec-Jan, Jul-Aug","Coastal-chic aesthetic featuring over 27,000 square feet of flexible space and a popular outdoor garden for social events",Frequent complaints regarding aircraft noise from the adjacent airport and high overnight parking fees,4,1308,Serious/Academic | Modern/Industrial | Public/See-and-be-Seen,"Positioned as a premier lifestyle anchor near John Wayne Airport, this property functions as a high-utility business command center with over 31,000 square feet of flexible event space, including the 7,140-square-foot Bay Laurel Ballroom and 20 versatile breakout rooms (Serious). Following a comprehensive renovation, the design delivers a ""coastal-chic"" aesthetic that blends contemporary sophistication with Southern California spirit, featuring tech-forward guest rooms and a multi-functional lobby designed for creative collaboration (Modern). Its status as a high-visibility social pillar is anchored by the ""Current Coastal Bar"" and the 10,000-square-foot Bamboo Garden—an outdoor oasis featuring fire pits and water features that serves as a primary networking hub for the Irvine and Newport business communities (Public)."
