"The Lytle Park Hotel, Autograph Collection",Cincinnati,Ohio,"Set in a historic 1909 building, this sophisticated hotel blends classic architectural heritage with a vibrant ""park-like"" interior design, serving as a luxurious urban oasis in the Lytle Park Historic District.","Retractable glass roof at Vista at Lytle Park (rooftop bar), fine Italian dining at Subito, 24-hour fitness center, curated local art collection, and complimentary house car service for local travel.",Autograph Collection (Marriott),106,5,"3,000","2,315",Cincinnati/Northern Kentucky International Airport (CVG),https://www.marriott.com/en-us/hotels/cvgak-the-lytle-park-hotel-autograph-collection/overview/,,20 minutes from CVG,150,May-Oct,Jan-Mar,Modern luxury in a historic 1909 building featuring a retractable glass roof on the Vista at Lytle Park rooftop bar and refined Italian dining,"Very limited indoor meeting space totaling only ~3,000 square feet and high valet-only parking costs ($50+)",4,600,Historic Charm | Modern/Industrial | Public/See-and-be-Seen,"Housed in two transformed 1909 buildings, this AAA Four Diamond property functions as a sophisticated ""urban manor,"" blending its Neoclassical roots with a sleek, nature-inspired modern aesthetic (Historic/Modern). The hotel serves as a high-visibility social anchor in Cincinnati’s Lytle Park District, driven by the buzzy energy of ""Vista""—the city’s only four-season rooftop bar with a retractable glass roof—and the upscale Italian dining at ""Subito"" (Public). While it leads with a refined lifestyle identity, it maintains a serious business edge with 11,000 square feet of versatile, tech-forward event space, including the ""Magnolia"" and ""Wisteria"" ballrooms that provide a polished backdrop for high-level executive retreats and boutique corporate summits (Serious/Modern)."
The Midland Hotel,Manchester,United Kingdom,"A legendary Edwardian landmark in the heart of Manchester city center, famous for being the meeting place of Charles Rolls and Henry Royce; this grand hotel blends rich historical prestige with modern luxury and award-winning culinary excellence.","The Rena Spa at The Midland (featuring a thermal suite and relaxation pool), state-of-the-art fitness center, on-site dining at the Michelin-starred Mana, Adam Reid at The French, and Mount Street Dining Room & Bar, plus the iconic Afternoon Tea in The Tea Room.",Independent (Managed by Pyramid Global),312,14,"12,000","6,500",Manchester Airport (MAN),https://www.themidlandhotel.co.uk/,,25 minutes from MAN,700,"May-Jul, Sep-Nov",Jan-Feb,"Legendary Edwardian landmark in Manchester city center featuring over 12,000 square feet of grand event space and the award-winning Mana restaurant","Strict historic preservation limits guest room modifications, leading to inconsistent room layouts and some aging bathroom fixtures",3,857,Historic Charm | Serious/Academic | Public/See-and-be-Seen,"Originally opened in 1903 as a grand railway hotel, this Manchester landmark functions as a ""Grade II listed"" storyteller, famous as the meeting place of Rolls and Royce (Historic). The property serves as a heavy-hitting business anchor, featuring 14 high-spec meeting rooms and a dedicated conference wing designed for high-stakes corporate execution and international summits (Serious). While it maintains a professional edge, it remains a high-visibility social pillar for the city, driven by the award-winning ""Tea Room"" and its reputation for prestigious dining, making it a central networking destination for the UK’s business and political elite (Public)."
The Old No. 77 Hotel & Chandlery,New Orleans,Louisiana,"An industrial-chic boutique hotel housed in three restored 19th-century warehouses, this property celebrates its heritage as a former general store for sailors with original brick walls, hardwood floors, and a curated gallery of local art.","Compere Lapin (award-winning Caribbean-European fusion), lobby coffee bar by Tout La, 24-hour fitness center, curated local retail shop, and pet-friendly ""VIP"" programming.",Independent (Managed by Pyramid Global),167,4,"2,500","1,512",Louis Armstrong New Orleans International Airport (MSY),https://www.old77hotel.com/,,25 minutes from MSY,150,"Oct-Dec, Feb-May",Jun-Aug,"Industrial-chic boutique hotel in a restored 19th-century warehouse featuring exposed brick, original beams, and the acclaimed Compère Lapin restaurant","Very limited indoor meeting space (~2,500 sq. ft.) and significant street noise due to the central Warehouse District location",3,625,Historic Charm | Modern/Industrial | Public/See-and-be-Seen,"Housed in an 1854 warehouse that once served as a chandlery for the Port of New Orleans, this property functions as a ruggedly elegant storyteller, preserving original brick walls, heavy timber beams, and industrial pipe-and-wood fixtures (Historic/Modern). The hotel serves as a high-visibility social and cultural anchor in the Warehouse District, driven by the James Beard Award-winning ""Compère Lapin"" and its rotating gallery of local art from the New Orleans Center for Creative Arts (Public). While it leads with a creative boutique identity, it maintains a professional utility with over 3,000 square feet of ""un-ballroom"" meeting space, including the ""Boardroom"" and ""Chandlery"" rooms designed for high-concept brainstorming and intimate corporate summits (Serious/Modern)."
The Shores Resort & Spa,Daytona Beach Shores,Florida,"The only AAA Four-Diamond oceanfront resort in Central Florida, this upscale destination offers a refined coastal experience with panoramic Atlantic views, blending casual Florida charm with sophisticated luxury.","Full-service Indulge Spa, oceanfront pool deck with private cabanas, signature beachfront fire pits with ""s'mores"" kits, on-site dining at Azure Restaurant & Bar, 24-hour fitness center, and exclusive Beach Jeep Tours.",Independent (Managed by Pyramid Global),212,14,"20,000","6,895",Daytona Beach International Airport (DAB),https://www.shoresresort.com/,,15 minutes from DAB,765,"Feb-May, Oct-Nov",Jun-Aug,"Only AAA Four-Diamond oceanfront resort in Daytona featuring 20,000 square feet of meeting space and a unique rooftop ballroom with 360-degree views",Guest rooms and corridors are starting to show significant age; recurring guest feedback regarding inconsistent housekeeping and high resort fees,3,1429,High-Energy/Buzzing | Luxury/Pampering | Athletic/Active,"Positioned as the only AAA Four-Diamond resort in Daytona Beach Shores, this property functions as a high-energy coastal playground defined by its Atlantic-front saltwater pool and signature beachfront fire pits with ""s’mores"" fixings (High-Energy). While it leads with a polished lifestyle identity—featuring the full-service ""Indulge Spa"" and a heavy emphasis on oceanfront wellness rituals (Luxury)—the resort serves as a versatile corporate anchor with over 20,000 square feet of"
"The StateView Hotel, Autograph Collection",Raleigh,North Carolina,"A tech-forward boutique hotel situated on NC State’s Centennial Campus, blending academic intellectualism with modern luxury and featuring a scenic design that overlooks the tranquil Lake Raleigh.","Outdoor heated pool and expansive terrace, 24-hour fitness center, on-site dining at Flask & Beaker (modern American), direct access to campus walking trails, and specialized tech-integrated meeting environments.",Autograph Collection (Marriott),164,9,"10,000","3,921",Raleigh-Durham International Airport (RDU),https://www.marriott.com/en-us/hotels/rduak-the-stateview-hotel-autograph-collection/overview/,,15 minutes from RDU,400,"Sep-Nov, Mar-May","Dec-Jan, Jul-Aug","Tech-forward boutique hotel on NC State’s Centennial Campus featuring over 10,000 square feet of high-tech space and a scenic outdoor terrace overlooking Lake Raleigh",Limited on-site dining options and guest rooms on lower floors can experience significant noise from the lobby and surrounding student activity,3,1111,Serious/Academic | Modern/Industrial | Secluded/Private,"Perched on the edge of Lake Raleigh within NC State University’s Centennial Campus, this property functions as a high-tech ""intellectual sanctuary"" designed for innovation and research-driven collaboration (Serious). The design reflects a sleek, ""smart-luxury"" aesthetic with industrial wood and metal finishes that pay homage to the university's textile and engineering heritage (Modern), while its wooded lakeside setting offers a quiet, ""off-the-grid"" feel just minutes from downtown (Secluded). Its status as a specialized business anchor is driven by its 10,000 square feet of high-spec meeting space and the terrace-style ""Flask & Beaker"" restaurant, which serves as a primary networking hub for the region's tech and academic leaders (Public)."
The Wade,Chicago,Illinois,"A modern boutique property in the vibrant West Loop, featuring high-design aesthetics and versatile studio-style meeting rooms that cater to a creative and entrepreneurial crowd seeking a sophisticated urban experience.","Popular rooftop lounge with skyline views, 24-hour fitness center, high-speed Wi-Fi, curated local art, and proximity to the city's premier dining and nightlife scene.",Independent (Managed by Pyramid Global),150,6,"5,000","4,290",Midway International Airport (MDW),https://www.thewadehotel.com/,,20 minutes from MDW,234,May-Oct,Jan-Mar,"Modern boutique property in the West Loop featuring high-design aesthetics, versatile studio-style meeting rooms, and a popular rooftop lounge",Limited on-site amenities compared to full-service convention hotels and the surrounding neighborhood can be quite noisy late into the night,3,833,Historic Charm | Modern/Industrial | Public/See-and-be-Seen,"Housed in the meticulously restored 1920s Wade-McClung building, this property functions as a high-visibility social anchor in the heart of Florence’s historic downtown (Historic). The design delivers a ""Southern-noir"" aesthetic, blending original architectural bones like exposed brick and arched windows with sleek, modern-industrial finishes and curated local photography (Modern). Its identity as a primary networking hub is driven by the rooftop ""Wade Rooftop Bar""—offering 360-degree views of the North Alabama skyline—and the ground-floor ""Gunner’s"" restaurant, creating a high-energy environment that bridges the gap between the city’s storied musical heritage and its burgeoning creative economy (Public)."
The Wigwam,Litchfield Park,Arizona,"A legendary 440-acre desert oasis with a history dating back to 1918, this historic landmark blends Adobe-style charm with sprawling luxury, offering a quintessential Arizona retreat defined by its lush grounds and deep-rooted Southwestern heritage.","Three championship golf courses (54 holes total), LeMonds Aveda Salon – Spa, four outdoor pools (including the Tower Pool with dual waterslides), 24-hour fitness center, nine tennis courts, and on-site dining at Litchfield’s, Red’s Bar & Grill, and Wigwam Bar.",Independent (Managed by Pyramid Global),331,25,"100,000","10,800",Phoenix Sky Harbor International Airport (PHX),https://www.wigwarmaz.com/,,30 minutes from PHX,"1,200","Jan-Apr, Oct-Nov",Jun-Aug,"Historic 440-acre desert oasis featuring three championship golf courses and 100,000 square feet of versatile indoor and outdoor event space",The expansive historic layout of the resort can lead to longer walks between guest rooms and conference facilities.,4,4000,Historic Charm | Athletic/Active | Serious/Academic,"Originally built in 1918 as ""Organization House""—a private retreat for Goodyear Tire & Rubber executives—this 440-acre desert oasis functions as one of Arizona’s most storied ""Southwestern-chic"" landmarks (Historic). The property serves as a heavy-hitting corporate anchor with 100,000 square feet of versatile event space, including the 10,800-square-foot Wigwam Ballroom and 25 high-spec meeting rooms designed for high-stakes executive strategy and regional summits (Serious). Despite its professional utility, the resort is a primary powerhouse for outdoor recreation, uniquely featuring 54 holes of championship golf across three distinct courses, nine tennis courts, and expansive ""Village Green"" lawns that provide a high-energy backdrop for team-building and social networking (Athletic)."
Thesis Hotel Miami,Coral Gables,Florida,"A modern, lifestyle-focused hotel located directly across from the University of Miami, designed as a cultural and communal hub that blends academic intellectualism with a sophisticated tropical urban aesthetic.","Rooftop pool and terrace with 360-degree views, 24-hour fitness center, complimentary specialized bike rentals, on-site dining at the award-winning Mamey and Orno (by Chef Niven Patel), and a vibrant community courtyard.",Independent (Managed by Pyramid Global),245,8,"20,000","2,228",Miami International Airport (MIA),https://www.thesishotelmiami.com/,,20 minutes from MIA,440,Jan-Apr,Jul-Sep,"Modern lifestyle hotel in Coral Gables with 6,500 square feet of stylish event space and top-tier dining by Chef Niven Patel",Limited meeting breakout options and significant traffic congestion on US-1 makes local travel difficult during business hours,4,2500,Modern/Industrial | Serious/Academic | Public/See-and-be-Seen,"Positioned as an ""urban living room"" at the crossroads of Coral Gables and South Miami, this 245-room Curio Collection property functions as a sleek, tech-forward intellectual hub directly across from the University of Miami (Serious). The design delivers a ""minimalist-luxury"" aesthetic with airy architecture and local art installations that blend Miami’s vibrant energy with a grounded, community-focused feel (Modern). Its status as a high-visibility social anchor is driven by its trio of chef-led culinary destinations—including the tropical ""Mamey"" and the Mediterranean-Asian fusion ""The Collab""—and a rooftop pool deck that serves as a primary networking pillar for the city's creative and academic elite (Public)."
Tivoli Lodge,Vail,Colorado,"A family-owned, European-style luxury lodge in the heart of Vail Village, blending authentic Bavarian charm with modern alpine luxury and offering a prestigious slopeside location just steps from Gondola One.","Two mountain-view outdoor hot tubs, state-of-the-art fitness center, ski valet and storage, on-site ""Brown Hound"" lobby bar, complimentary hot breakfast buffet, and ""Skipper"" (the resident Golden Retriever) to welcome guests.",Independent (Managed by Pyramid Global),65,2,"1,500",700,Eagle County Regional Airport (EGE) / Denver International (DEN),https://www.tivolilodge.com/,,45 minutes from EGE,40,"Dec-Mar, Jul-Aug","May, Oct-Nov","European-style luxury lodge in Vail Village with personalized service and a cozy, upscale mountain atmosphere","Very limited indoor meeting space (~1,500 sq. ft.) and high seasonal rates that often include strict minimum stay requirements",4,750,Historic Charm | Secluded/Private | Athletic/Active,"Nestled at the base of Vail Mountain in the heart of Vail Village, this family-owned property functions as a refined ""Tyrolean-style"" sanctuary, blending traditional European alpine architecture with a boutique modern interior (Historic/Modern). The lodge serves as an intimate business anchor for high-level executive retreats, featuring the Wedel Conference Room—a 900-square-foot space with natural light and double glass French doors that open to a private mountainside patio (Serious/Secluded). Its identity as a primary networking hub for the ski community is driven by the ""Brown Hound Lounge,"" a legendary lobby bar named after the property’s resident chocolate Labrador mascot, providing a high-visibility social pillar for après-ski meetings and fireside collaboration (Public)."
Virginia Guesthouse,Charlottesville,Virginia,"A charming, historic estate that offers an intimate residential feel, specifically designed for private executive retreats and leadership summits seeking a secluded, focused environment away from traditional corporate settings.","Personalized concierge service, curated local farm-to-table culinary programs, scenic outdoor garden and patio spaces, high-speed fiber internet, and proximity to the University of Virginia and local Monticello wine trail.",Independent (Managed by Pyramid Global),25,2,800,800,Charlottesville–Albemarle Airport (CHO),https://www.virginiaguesthouse.com/,,20 minutes from CHO,40,May-Oct,Dec-Feb,"Historic and charming guest house in the heart of Charlottesville offering a personalized, intimate setting for small leadership retreats",Extremely limited dedicated meeting space (~800 sq. ft.) and lacks the robust AV infrastructure of larger full-service hotels,2,400,Serious/Academic | Modern/Industrial | Public/See-and-be-Seen,"Scheduled to open in April 2026 on the University of Virginia's Grounds, this 214-room property functions as a dynamic ""intellectual hub"" designed to foster regional partnerships and robust corporate outreach. The design delivers a contemporary embodiment of Jeffersonian principles, blending modern, tech-forward amenities with natural textures. Its status as a high-visibility social pillar is driven by ""The Perch"" rooftop bar and a 25,000-square-foot IACC-certified conference center, providing an elite benchmark for capturing business from local markets and corporate symposiums. Capacity: 150-900 attendees. Link: https://www.virginiaguesthouse.com/"
Wayfinder Bishop,Bishop,California,"A modernized boutique mountain retreat located at the base of the Eastern Sierra, featuring a tranquil on-site creek and a rugged-yet-refined aesthetic designed for adventurers and creative off-sites.","Seasonal outdoor pool and oversized hot tub, Whistling Trout lobby bar and lounge, 24-hour fitness center, on-site fire pits, curated local adventure guides, and direct access to world-class bouldering and hiking trails.",Independent (Managed by Pyramid Global),87,2,"1,200","1,252",Bishop Airport (BIH),https://www.wayfinderhotels.com/hotels/bishop,,10 minutes from BIH,120,"Jun-Aug, Jan-Mar","Apr-May, Oct-Nov","Modernized boutique mountain retreat featuring a tranquil on-site creek, custom-designed interiors, and a popular lobby bar/lounge area",Minimal indoor meeting facilities limited to small breakout spaces and guest rooms are on the smaller side with thin walls,3,600,Secluded/Private | Athletic/Active | Modern/Industrial,"Positioned as an immersive basecamp in California's High Sierra, this 87-room boutique lodge functions as a gateway to outdoor adventure along Bishop Creek. Following a 2024 renovation, the property blends rustic mountain charm with contemporary design, featuring earth tones, local art, and an Estonian poolside sauna. While it leans heavily into its identity as an active leisure retreat—offering unique amenities like a dedicated trout-cleaning room and access to world-class rock climbing—it serves as an intimate venue for small groups with 1,000 square feet of semi-private event space and cozy fire-pit lounges. Capacity: 10-50 attendees. Link: https://www.wayfinderbishop.com/"
Wayfinder Newport,Newport,Rhode Island,"A recently renovated boutique property that captures the creative spirit of Rhode Island, featuring local artwork, a hip poolside scene, and flexible studio spaces designed for coastal retreats and creative workshops.","Seasonal outdoor pool and deck, 24-hour fitness center, on-site dining at B-Side (New England-inspired comfort food), curated retail featuring local artisans, and flexible ""B-Side"" studio spaces for meetings and events.",Independent (Managed by Pyramid Global),197,4,"4,000","2,500",Rhode Island T.F. Green International Airport (PVD),https://www.wayfindernewport.com/,,40 minutes from PVD,150,Jun-Aug,Nov-Mar,"Recently renovated boutique property featuring local Rhode Island artwork, a hip poolside scene, and flexible studio spaces for creative retreats",Location is slightly removed from the downtown Newport waterfront and guest reviews frequently mention thin walls and inconsistent service levels,3,1000,Modern/Industrial | Public/See-and-be-Seen | Athletic/Active,"Created by a collective of local chefs and designers, this 187-room boutique property functions as a ""fresh coastal hideaway"" that trades traditional nautical tropes for a 1970s-inspired, ""maker culture"" aesthetic (Modern/Industrial). The hotel serves as a high-visibility social anchor in Newport’s North End, driven by the buzzy ""Little Clam"" restaurant—led by Hell’s Kitchen talent—and the ""Poolshack,"" a seasonal hotspot for frozen cocktails and poolside networking (Public). While it leads with a laid-back lifestyle identity, it maintains a serious business edge with over 3,000 square feet of versatile event space, including the 1,700-square-foot Telltale Room and the sun-drenched Solarium designed for high-concept brainstorming and creative corporate summits (Serious/Modern). Capacity: 10–150 attendees. Link: https://www.way"
Wayfinder Waikiki,Honolulu,Hawaii,"A ""Tropical Brutalist"" boutique hotel that reimagines the Waikiki experience with a design-forward aesthetic, blending raw concrete textures with lush island flora and a vibrant social scene tailored for the modern traveler.","70-foot saltwater pool and tropical pool deck, on-site dining at Redfish Poke Bar (by Foodland), B-Side (coffee and light bites), Lost + Found (speakeasy-style poolside bar), 24-hour fitness center, and complimentary GoPro rentals for guest adventures.",Independent (Managed by Pyramid Global),228,2,"2,000",600,Daniel K. Inouye International Airport (HNL),https://www.wayfinderhotels.com/hotels/waikiki,,20 minutes from HNL,40,"Apr-Jun, Sep-Nov",Dec-Mar,"Tropical-brutalist boutique hotel featuring a saltwater pool, Redfish Poke bar, and a trendy, design-forward atmosphere tucked away from the main strip",Extremely limited meeting facilities with no large traditional ballrooms; guest rooms are notably compact and the surrounding area can be noisy,3,1000,Modern/Industrial | Serious/Academic | Public/See-and-be-Seen,"Repositioned in 2023 following an extensive transformation of a midcentury Brutalist building, this 228-room property functions as an immersive ""intellectual oasis"" along the Ala Wai Canal. The design delivers a ""Kama'aina"" aesthetic that merges raw architectural bones with tropical patterns, natural fiber furniture, and local art curated by The Vanguard Theory (Modern/Historic). The hotel serves as a high-visibility social anchor driven by a tropical speakeasy poolside bar, ""Lost + Found,"" and the innovative ""Redfish"" poke restaurant, which functions as a primary networking hub for Honolulu’s creative community (Public). While it leads with a lifestyle identity, it offers professional utility with approximately 2,500 square feet of flexible indoor/outdoor event space—including two Penthouse suites and the 600-square-foot Wayfinder Suite—designed for intimate corporate retreats and high-concept strategy sessions (Serious)."
Westin Grand Cayman Seven Mile Beach Resort & Spa,Grand Cayman,Cayman Islands,"A premier oceanfront sanctuary situated on the widest and finest stretch of the world-famous Seven Mile Beach, blending contemporary Caribbean luxury with an expansive beach presence and a focus on restorative wellness and high-end coastal experiences.","The largest freshwater pool in Grand Cayman (with swim-up bar), full-service Hibiscus Spa, 24-hour WestinWORKOUT Fitness Studio, on-site dining at Beach House (fine dining), Ferdinand’s (Caribbean), and Tortuga Beach Grill, plus extensive water sports through Red Sail Sports.",Westin (Marriott),343,7,"9,000","5,600",Owen Roberts International Airport (GCM),https://www.marriott.com/en-us/hotels/gcmmw-the-westin-grand-cayman-seven-mile-beach-resort-and-spa/overview/,,15 minutes from GCM,800,Jan-Apr,Jul-Oct,"Prime oceanfront resort on Seven Mile Beach featuring over 9,000 square feet of indoor meeting space and extensive beachfront event lawns",High daily resort fees ($70+) and premium food and beverage pricing typical of Grand Cayman; beach erosion has significantly reduced the sand area in recent years,4,1286,Serious/Academic | Luxury/Pampering | Public/See-and-be-Seen,"Occupying the most expansive stretch of the world-renowned Seven Mile Beach, this AAA Four Diamond property functions as a heavy-hitting corporate anchor in the Caribbean. The resort serves as a high-utility business hub, featuring nearly 9,000 square feet of sophisticated indoor event space—including the 5,600-square-foot Governors Ballroom—and an additional 70,000 square feet of pristine beachfront for high-impact outdoor summits and networking (Serious). While it maintains a professional edge, its status as a high-visibility social pillar is driven by the island’s largest freshwater pool, the full-service Hibiscus Spa, and a diverse culinary program featuring the award-winning ""Beach House"" and the island-centric sushi at ""woto"" (Public/Luxury). The property seamlessly bridges the gap between a tech-forward conference center and a polished lifestyle destination, making it a primary choice for high-stakes executive retreats and large-scale regional incentives. Capacity: 50–800 attendees"
